{
  "$schema": "http://json-schema.org/draft-07/schema#",
  "$id": "pin:claude-code-marketplace.min.schema.json",
  "$comment": "Minimal typed subset pinned from SchemaStore https://json.schemastore.org/claude-code-marketplace.json (fetched 2026-08-07). Source anyOf and component path shapes are simplified to type-level checks; unique plugins[].name is asserted in tests (not in upstream schema).",
  "title": "Claude Code Marketplace (minimal pin)",
  "type": "object",
  "required": [
    "name",
    "owner",
    "plugins"
  ],
  "properties": {
    "$schema": {
      "description": "JSON Schema reference for editor autocomplete/validation; ignored at load time",
      "type": "string"
    },
    "name": {
      "type": "string",
      "minLength": 1
    },
    "version": {
      "description": "Marketplace manifest version",
      "type": "string"
    },
    "description": {
      "description": "Human-readable description of this marketplace",
      "type": "string"
    },
    "owner": {
      "description": "Marketplace maintainer or curator information",
      "type": "object",
      "properties": {
        "name": {
          "description": "Display name of the plugin author or organization",
          "type": "string",
          "minLength": 1
        },
        "email": {
          "description": "Contact email for support or feedback",
          "type": "string"
        },
        "url": {
          "description": "Website, GitHub profile, or organization URL",
          "type": "string"
        }
      },
      "required": [
        "name"
      ]
    },
    "plugins": {
      "type": "array",
      "description": "Collection of available plugins in this marketplace",
      "items": {
        "type": "object",
        "required": [
          "name",
          "source"
        ],
        "properties": {
          "name": {
            "description": "Unique identifier matching the plugin name",
            "type": "string",
            "minLength": 1
          },
          "source": {
            "description": "Where to fetch the plugin from",
            "anyOf": [
              {
                "type": "string",
                "minLength": 1
              },
              {
                "type": "object"
              }
            ]
          },
          "strict": {
            "description": "Require the plugin manifest to be present in the plugin folder. If false, the marketplace entry provides the manifest.",
            "default": true,
            "type": "boolean"
          },
          "description": {
            "description": "Brief, user-facing explanation of what the plugin provides",
            "type": "string"
          },
          "author": {
            "description": "Information about the plugin creator or maintainer",
            "type": "object",
            "properties": {
              "name": {
                "description": "Display name of the plugin author or organization",
                "type": "string",
                "minLength": 1
              },
              "email": {
                "description": "Contact email for support or feedback",
                "type": "string"
              },
              "url": {
                "description": "Website, GitHub profile, or organization URL",
                "type": "string"
              }
            },
            "required": [
              "name"
            ]
          },
          "license": {
            "description": "SPDX license identifier (e.g., MIT, Apache-2.0)",
            "type": "string"
          },
          "category": {
            "type": "string"
          },
          "keywords": {
            "description": "Tags for plugin discovery and categorization",
            "type": "array",
            "items": {
              "type": "string"
            }
          },
          "skills": {
            "type": "array",
            "items": {
              "type": "string"
            }
          },
          "commands": {
            "type": "array",
            "items": {
              "type": "string"
            }
          },
          "version": {
            "description": "Semantic version (e.g., 1.2.3) following semver.org specification",
            "type": "string"
          },
          "homepage": {
            "type": "string"
          },
          "repository": {
            "type": "string"
          },
          "tags": {
            "type": "array",
            "items": {
              "type": "string"
            }
          }
        }
      }
    }
  }
}
