{
  "$schema": "https://json.schemastore.org/claude-code-marketplace.json",
  "name": "house-rules",
  "owner": {
    "name": "Kevin Glynn",
    "url": "https://github.com/kevglynn"
  },
  "description": "Versioned engineering playbook for AI coding agents: checkable rules, skills, and checker CLIs.",
  "plugins": [
    {
      "name": "house-rules-core",
      "source": "./",
      "strict": false,
      "description": "Zero-dependency core tier: graybeard skills, prose-voice, and checker CLIs (bin/defer-lint, bin/banned-token-scan on the Bash PATH; local init also ships scripts/). Always-on contract (explicit downgrade): Claude has no Cursor alwaysApply — core rules ship as discoverable commands/skills, not always-on policy. No task-tracking workflow required.",
      "author": { "name": "Kevin Glynn" },
      "license": "Apache-2.0",
      "category": "productivity",
      "keywords": ["rules", "code-review", "over-engineering", "prose-voice", "checkers"],
      "skills": [
        "./skills/graybeard-review",
        "./skills/graybeard-audit",
        "./skills/graybeard-debt",
        "./skills/graybeard-help",
        "./skills/prose-voice"
      ],
      "commands": [
        "./claude/rules/agent-identity.md",
        "./claude/rules/defer-convention.md",
        "./claude/rules/prose-voice.md",
        "./claude/rules/parallel-subagent-safety.md",
        "./claude/rules/graybeard-playbook.md",
        "./claude/rules/core-upgrade-offer.md"
      ]
    },
    {
      "name": "house-rules-full",
      "source": "./",
      "strict": false,
      "description": "The full playbook: beads task workflow, session lifecycle, planning and review skills, and every rule loadable as a command. Pairs with the beads CLI (bd) and the house-rules init installer.",
      "author": { "name": "Kevin Glynn" },
      "license": "Apache-2.0",
      "category": "productivity",
      "keywords": ["workflow", "task-tracking", "tdd", "planning", "review"],
      "skills": ["./skills/"],
      "commands": ["./claude/rules/"]
    }
  ]
}
